{
  "schemaVersion": "2.0.0",
  "sourceDesignRevision": "a53052955ceb6c1aa10c886289dc832eedfe6de0a00004df07d353ac19c4403a",
  "contracts": [
    {
      "contractId": "urn:gala:metadata:build-provenance:2.0.0",
      "producer": {
        "artifact": "@rathnasgala2/schemas",
        "version": "2.0.0",
        "oldestAcceptedVersion": "2.0.0",
        "previousSupportedVersion": null,
        "previousVersionDisposition": "INITIAL_RELEASE_NO_PREVIOUS_VERSION",
        "status": "current",
        "introducedOn": "2026-09-06",
        "deprecatedOn": null,
        "retiredOn": null,
        "supportEvidence": ["DEC-071", "DEC-078", "S0-T05"]
      },
      "consumers": [
        {
          "artifact": "api",
          "version": "2.0.0",
          "supportedProducerRange": ">=2.0.0 <2.1.0"
        },
        {
          "artifact": "publish",
          "version": "2.0.0",
          "supportedProducerRange": ">=2.0.0 <2.1.0"
        }
      ]
    },
    {
      "contractId": "urn:gala:schema:adapter-capability:2.0.0",
      "producer": {
        "artifact": "@rathnasgala2/schemas",
        "version": "2.0.0",
        "oldestAcceptedVersion": "2.0.0",
        "previousSupportedVersion": null,
        "previousVersionDisposition": "INITIAL_RELEASE_NO_PREVIOUS_VERSION",
        "status": "current",
        "introducedOn": "2026-09-06",
        "deprecatedOn": null,
        "retiredOn": null,
        "supportEvidence": ["DEC-071", "DEC-078", "S0-T05"]
      },
      "consumers": [
        {
          "artifact": "api",
          "version": "2.0.0",
          "supportedProducerRange": ">=2.0.0 <2.1.0"
        },
        {
          "artifact": "publish",
          "version": "2.0.0",
          "supportedProducerRange": ">=2.0.0 <2.1.0"
        }
      ]
    },
    {
      "contractId": "urn:gala:schema:appearance:2.0.0",
      "producer": {
        "artifact": "@rathnasgala2/schemas",
        "version": "2.0.0",
        "oldestAcceptedVersion": "2.0.0",
        "previousSupportedVersion": null,
        "previousVersionDisposition": "INITIAL_RELEASE_NO_PREVIOUS_VERSION",
        "status": "current",
        "introducedOn": "2026-09-06",
        "deprecatedOn": null,
        "retiredOn": null,
        "supportEvidence": ["DEC-071", "DEC-078", "S0-T05"]
      },
      "consumers": [
        {
          "artifact": "api",
          "version": "2.0.0",
          "supportedProducerRange": ">=2.0.0 <2.1.0"
        },
        {
          "artifact": "template",
          "version": "2.0.0",
          "supportedProducerRange": ">=2.0.0 <2.1.0"
        }
      ]
    },
    {
      "contractId": "urn:gala:schema:artifact-manifest:2.0.0",
      "producer": {
        "artifact": "@rathnasgala2/schemas",
        "version": "2.0.0",
        "oldestAcceptedVersion": "2.0.0",
        "previousSupportedVersion": null,
        "previousVersionDisposition": "INITIAL_RELEASE_NO_PREVIOUS_VERSION",
        "status": "current",
        "introducedOn": "2026-09-06",
        "deprecatedOn": null,
        "retiredOn": null,
        "supportEvidence": ["DEC-071", "DEC-078", "S0-T05"]
      },
      "consumers": [
        {
          "artifact": "api",
          "version": "2.0.0",
          "supportedProducerRange": ">=2.0.0 <2.1.0"
        },
        {
          "artifact": "publish",
          "version": "2.0.0",
          "supportedProducerRange": ">=2.0.0 <2.1.0"
        }
      ]
    },
    {
      "contractId": "urn:gala:schema:author:2.0.0",
      "producer": {
        "artifact": "@rathnasgala2/schemas",
        "version": "2.0.0",
        "oldestAcceptedVersion": "2.0.0",
        "previousSupportedVersion": null,
        "previousVersionDisposition": "INITIAL_RELEASE_NO_PREVIOUS_VERSION",
        "status": "current",
        "introducedOn": "2026-09-06",
        "deprecatedOn": null,
        "retiredOn": null,
        "supportEvidence": ["DEC-071", "DEC-078", "S0-T05"]
      },
      "consumers": [
        {
          "artifact": "api",
          "version": "2.0.0",
          "supportedProducerRange": ">=2.0.0 <2.1.0"
        },
        {
          "artifact": "template",
          "version": "2.0.0",
          "supportedProducerRange": ">=2.0.0 <2.1.0"
        }
      ]
    },
    {
      "contractId": "urn:gala:schema:build-input:2.0.0",
      "producer": {
        "artifact": "@rathnasgala2/schemas",
        "version": "2.0.0",
        "oldestAcceptedVersion": "2.0.0",
        "previousSupportedVersion": null,
        "previousVersionDisposition": "INITIAL_RELEASE_NO_PREVIOUS_VERSION",
        "status": "current",
        "introducedOn": "2026-09-06",
        "deprecatedOn": null,
        "retiredOn": null,
        "supportEvidence": ["DEC-071", "DEC-078", "S0-T05"]
      },
      "consumers": [
        {
          "artifact": "template",
          "version": "2.0.0",
          "supportedProducerRange": ">=2.0.0 <2.1.0"
        }
      ]
    },
    {
      "contractId": "urn:gala:schema:content-frontmatter:2.0.0",
      "producer": {
        "artifact": "@rathnasgala2/schemas",
        "version": "2.0.0",
        "oldestAcceptedVersion": "2.0.0",
        "previousSupportedVersion": null,
        "previousVersionDisposition": "INITIAL_RELEASE_NO_PREVIOUS_VERSION",
        "status": "current",
        "introducedOn": "2026-09-06",
        "deprecatedOn": null,
        "retiredOn": null,
        "supportEvidence": ["DEC-071", "DEC-078", "S0-T05"]
      },
      "consumers": [
        {
          "artifact": "api",
          "version": "2.0.0",
          "supportedProducerRange": ">=2.0.0 <2.1.0"
        },
        {
          "artifact": "template",
          "version": "2.0.0",
          "supportedProducerRange": ">=2.0.0 <2.1.0"
        }
      ]
    },
    {
      "contractId": "urn:gala:schema:deployment-intent:2.0.0",
      "producer": {
        "artifact": "@rathnasgala2/schemas",
        "version": "2.0.0",
        "oldestAcceptedVersion": "2.0.0",
        "previousSupportedVersion": null,
        "previousVersionDisposition": "INITIAL_RELEASE_NO_PREVIOUS_VERSION",
        "status": "current",
        "introducedOn": "2026-09-06",
        "deprecatedOn": null,
        "retiredOn": null,
        "supportEvidence": ["DEC-071", "DEC-078", "S0-T05"]
      },
      "consumers": [
        {
          "artifact": "api",
          "version": "2.0.0",
          "supportedProducerRange": ">=2.0.0 <2.1.0"
        },
        {
          "artifact": "publish",
          "version": "2.0.0",
          "supportedProducerRange": ">=2.0.0 <2.1.0"
        }
      ]
    },
    {
      "contractId": "urn:gala:schema:deployment-observation:2.0.0",
      "producer": {
        "artifact": "@rathnasgala2/schemas",
        "version": "2.0.0",
        "oldestAcceptedVersion": "2.0.0",
        "previousSupportedVersion": null,
        "previousVersionDisposition": "INITIAL_RELEASE_NO_PREVIOUS_VERSION",
        "status": "current",
        "introducedOn": "2026-09-06",
        "deprecatedOn": null,
        "retiredOn": null,
        "supportEvidence": ["DEC-071", "DEC-078", "S0-T05"]
      },
      "consumers": [
        {
          "artifact": "api",
          "version": "2.0.0",
          "supportedProducerRange": ">=2.0.0 <2.1.0"
        },
        {
          "artifact": "publish",
          "version": "2.0.0",
          "supportedProducerRange": ">=2.0.0 <2.1.0"
        }
      ]
    },
    {
      "contractId": "urn:gala:schema:deployment-receipt:2.0.0",
      "producer": {
        "artifact": "@rathnasgala2/schemas",
        "version": "2.0.0",
        "oldestAcceptedVersion": "2.0.0",
        "previousSupportedVersion": null,
        "previousVersionDisposition": "INITIAL_RELEASE_NO_PREVIOUS_VERSION",
        "status": "current",
        "introducedOn": "2026-09-06",
        "deprecatedOn": null,
        "retiredOn": null,
        "supportEvidence": ["DEC-071", "DEC-078", "S0-T05"]
      },
      "consumers": [
        {
          "artifact": "api",
          "version": "2.0.0",
          "supportedProducerRange": ">=2.0.0 <2.1.0"
        },
        {
          "artifact": "publish",
          "version": "2.0.0",
          "supportedProducerRange": ">=2.0.0 <2.1.0"
        }
      ]
    },
    {
      "contractId": "urn:gala:schema:event-envelope:2.0.0",
      "producer": {
        "artifact": "@rathnasgala2/schemas",
        "version": "2.0.0",
        "oldestAcceptedVersion": "2.0.0",
        "previousSupportedVersion": null,
        "previousVersionDisposition": "INITIAL_RELEASE_NO_PREVIOUS_VERSION",
        "status": "current",
        "introducedOn": "2026-09-06",
        "deprecatedOn": null,
        "retiredOn": null,
        "supportEvidence": ["DEC-071", "DEC-078", "S0-T05"]
      },
      "consumers": [
        {
          "artifact": "api",
          "version": "2.0.0",
          "supportedProducerRange": ">=2.0.0 <2.1.0"
        },
        {
          "artifact": "app",
          "version": "2.0.0",
          "supportedProducerRange": ">=2.0.0 <2.1.0"
        }
      ]
    },
    {
      "contractId": "urn:gala:schema:lock:2.0.0",
      "producer": {
        "artifact": "@rathnasgala2/schemas",
        "version": "2.0.0",
        "oldestAcceptedVersion": "2.0.0",
        "previousSupportedVersion": null,
        "previousVersionDisposition": "INITIAL_RELEASE_NO_PREVIOUS_VERSION",
        "status": "current",
        "introducedOn": "2026-09-06",
        "deprecatedOn": null,
        "retiredOn": null,
        "supportEvidence": ["DEC-071", "DEC-078", "S0-T05"]
      },
      "consumers": [
        {
          "artifact": "publish",
          "version": "2.0.0",
          "supportedProducerRange": ">=2.0.0 <2.1.0"
        },
        {
          "artifact": "template",
          "version": "2.0.0",
          "supportedProducerRange": ">=2.0.0 <2.1.0"
        }
      ]
    },
    {
      "contractId": "urn:gala:schema:navigation:2.0.0",
      "producer": {
        "artifact": "@rathnasgala2/schemas",
        "version": "2.0.0",